{
  "$schema": "https://json-schema.org/draft/2020-12/schema",
  "$id": "https://raw.githubusercontent.com/vanderbr/rates/main/schemas/v1/actuarial-table-h.schema.json",
  "title": "actuarial-table-h",
  "type": "array",
  "items": {
    "type": "object",
    "additionalProperties": false,
    "required": [
      "age",
      "dx_scaled_1e6",
      "nx_scaled_1e6",
      "mx_scaled_1e6"
    ],
    "properties": {
      "age": {
        "type": "integer",
        "minimum": 0
      },
      "dx_scaled_1e6": {
        "type": "integer",
        "minimum": 0
      },
      "nx_scaled_1e6": {
        "type": "integer",
        "minimum": 0
      },
      "mx_scaled_1e6": {
        "type": "integer",
        "minimum": 0
      }
    }
  }
}
